<?xml version="1.0" encoding="UTF-8" ?>
<!DOCTYPE hotwheel-mybatis
        PUBLIC "-//hotwheel.org//DTD Config 3.0//EN"
        "http://hotwheel.org/dtd/hotwheel-mybatis-config.dtd">

<hotwheel-mybatis>

    <properties resource="mysql-jdbc.properties"/>

    <environments default="development">
        <environment id="development">
            <transactionManager type="JDBC"/>
            <dataSource id="cuishou" class="org.hotwheel.mybatis.HotWheelDataSourceFactory" destroy-method="close">
                <property name="driverClassName" value="${cuishou.driver}" />
                <property name="url" value="${cuishou.url}" />
                <property name="username" value="${cuishou.username}" />
                <property name="password" value="${cuishou.password}" />

                <property name="initialSize" value="${pool.initialSize}" />
                <property name="maxActive" value="${pool.maxActive}" />
                <property name="maxIdle" value="${pool.maxIdle}"/>
                <property name="minIdle" value="${pool.minIdle}" />
                <property name="timeBetweenEvictionRunsMillis" value="${pool.timeBetweenEvictionRunsMillis}" />
                <property name="minEvictableIdleTimeMillis" value="${pool.minEvictableIdleTimeMillis}" />
                <property name="removeAbandoned" value="${pool.removeAbandoned}" />
                <property name="removeAbandonedTimeout" value="${pool.removeAbandonedTimeout}" />
                <property name="maxWait" value="${pool.maxWait}" />
                <property name="validationQuery" value="${pool.validationQuery}" />
                <property name="testOnBorrow" value="${pool.testOnBorrow}" />
                <property name="testWhileIdle" value="${pool.testWhileIdle}" />
                <property name="jdbcInterceptors" value="${pool.jdbcInterceptors}"/>
            </dataSource>
        </environment>
    </environments>

    <mappers>
        <mapper resource="ermas.xml"/>
    </mappers>

</hotwheel-mybatis>
